,title,address.street-address,name,address,distance
203,CMSc Centro Municipal de Salud Comunitaria Villa de Vallecas,CALLE SIERRA GADOR 68,Pavones,Calle Hacienda de Pavones nº 342,2684.549124884858
204,Centro de Especialidades Periférico Peña Grande,CALLE ISLA DE CERDE&amp;Ntilde;A 8,Facultad Derecho,Avenida Complutense nº 23,2701.746664014337
205,Clínica Universidad de Navarra en Madrid,CALLE MARQUESADO DE SANTA MARTA 1,Gutierre de Cetina,Calle Gutierre de Cetina nº 77,2708.3204211582406
206,Centro de Atención Integral a Drogodependientes CAID Este,PLAZA CIVICA  esquina C/ Pobladura del Valle,Gutierre de Cetina,Calle Gutierre de Cetina nº 77,2747.364244590051
207,Hospital Virgen de La Torre,CALLE PUERTO DE LUMBRERAS 5,Pavones,Calle Hacienda de Pavones nº 342,2750.258226593873
208,CMSc Centro Municipal de Salud Comunitaria Vicálvaro,CALLE CALAHORRA 11,Pavones,Calle Hacienda de Pavones nº 342,2779.862122497032
209,Centro de Salud Aquitania,CALLE AQUITANIA 22,Pavones,Calle Hacienda de Pavones nº 342,2784.5131650599337
210,Centro de Salud Virgen del Cortijo,AVENIDA MANOTERAS 47,Manuel Caldeiro,Paseo de la Castellana nº 298,2798.8204924185775
211,Hospital Universitario Sanitas La Moraleja,AVENIDA FRANCISCO PI Y MARGALL 81,Manuel Caldeiro,Paseo de la Castellana nº 298,2894.5588461725165
212,Centro de Salud Artilleros,PASEO ARTILLEROS 31,Pavones,Calle Hacienda de Pavones nº 342,2922.0759198709015
213,Centro de Salud Monóvar,CALLE MONOVAR 11,Pío XII,Avenida Pío XII nº 3,2956.3765299237843
214,Hospital Central de la Defensa Gómez Ulla,GLORIETA EJERCITO 1,Caramuel,Calle Caramuel nº 51,3020.031894685903
215,Centro de Atención a las Adicciones (CAD) de Hortaleza,CALLE MINAYA 7,Carlota O’Neill,Calle Carlota O'Neill nº 32,3087.10897141507
216,Hospital Ruber Internacional,CALLE MASO 38,Pedro Rico,Calle Pedro Rico nº 4,3094.252989967391
217,Centro de Salud Mental Hortaleza,CALLE MAR DE KARA  FRENTE A NÚMERO 18,Carlota O’Neill,Calle Carlota O'Neill nº 32,3097.9126999083
218,Centro de Especialidades Periférico Emigrantes,CALLE AREQUIPA 30 PLANTA 3,Carlota O’Neill,Calle Carlota O'Neill nº 32,3114.6347103357725
219,Centro de Salud Los Yébenes,CALLE LOS YEBENES 46,Caramuel,Calle Caramuel nº 51,3186.349211627115
220,CMSc Centro Municipal de Salud Comunitaria Hortaleza,CALLE JUAN CLEMENTE NUÑEZ 3 frente a Silvano 157,Carlota O’Neill,Calle Carlota O'Neill nº 32,3196.748288548021
221,Centro de Salud Mar Báltico,CALLE MAR BALTICO 2,Carlota O’Neill,Calle Carlota O'Neill nº 32,3293.4553208915677
222,CMSc Centro Municipal de Salud Comunitaria Villaverde,AVENIDA FELICIDAD 17,Embajadores 191,Calle Sodio nº 1B,3323.3660490716343
223,Centro de Salud Bucodental,AVENIDA FELICIDAD 17,Embajadores 191,Calle Sodio nº 1B,3323.3660490716343
224,Centro de Salud Canillejas,CALLE BOLTAÑA 5,Gutierre de Cetina,Calle Gutierre de Cetina nº 77,3411.5861165327806
225,Centro de Salud el Espinillo,AVENIDA OROVILLA 53,Embajadores 191,Calle Sodio nº 1B,3412.7166742480567
226,Centro de Atención a las Adicciones (CAD) de Latina,CALLE CAMARENA 10,Caramuel,Calle Caramuel nº 51,3423.901233992529
227,Clínica San Vicente,AVENIDA VENTISQUERO DE LA CONDESA 46 PLANTA 4,Pedro Rico,Calle Pedro Rico nº 4,3462.4898668411784
228,Clínica CEMTRO,AVENIDA VENTISQUERO DE LA CONDESA 42,Pedro Rico,Calle Pedro Rico nº 4,3462.4898668411784
229,Centro de Salud Villa de Vallecas,CALLE FUENTIDUEÑA 12,Pavones,Calle Hacienda de Pavones nº 342,3471.4060573511188
230,Centro de Salud Sanchinarro,CALLE ANA DE AUSTRIA 26,Manuel Caldeiro,Paseo de la Castellana nº 298,3473.3621054721657
231,Centro de Salud Los Alpes,CALLE SUECIA 62,Gutierre de Cetina,Calle Gutierre de Cetina nº 77,3487.1746542913825
232,Centro de Salud Fuentelarreina,CALLE ALFONSO RODRIGUEZ CASTELAO 17,Facultad Derecho,Avenida Complutense nº 23,3501.0162686804238
233,Centro de Salud Mirasierra,CALLE MIRADOR DE LA REINA 117,Pedro Rico,Calle Pedro Rico nº 4,3551.2802062862497
234,Centro de Salud Ensanche de Vallecas,CALLE CINCOVILLAS 1,Pavones,Calle Hacienda de Pavones nº 342,3758.3769678003846
235,Centro de Atención Integral a Drogodependientes CAID Vallecas,CALLE CINCOVILLAS 5,Pavones,Calle Hacienda de Pavones nº 342,3758.951155195451
236,Centro de Salud Villablanca,CALLE VILLABLANCA 81,Pavones,Calle Hacienda de Pavones nº 342,3964.2923569341306
237,Centro de Salud Cerro Almodóvar,CALLE FUENTESPINA 2,Pavones,Calle Hacienda de Pavones nº 342,4008.251610089387
238,Centro de Salud Nuestra Señora de Fátima,AVENIDA NUESTRA SEÑORA DE FATIMA 93,Caramuel,Calle Caramuel nº 51,4029.792705989818
239,Centro de Salud Los Rosales,CALLE DIAMANTE 12,Embajadores 191,Calle Sodio nº 1B,4031.635339195726
240,CMSc Centro Municipal de Salud Comunitaria Carabanchel,CALLE EUGENIA DE MONTIJO 90,Caramuel,Calle Caramuel nº 51,4076.820221416857
241,Centro de Salud Los Ángeles,CALLE TOTANES 1,Glorieta de Cádiz,Calle Antonio López nº 129,4199.558451929779
242,Centro de Salud Mental de Villaverde,CALLE DE TOTANES 1 PLANTA 4ª,Glorieta de Cádiz,Calle Antonio López nº 129,4200.510884468132
243,Centro de Salud Potes,CALLE POTES 2,Glorieta de Cádiz,Calle Antonio López nº 129,4378.874740839941
244,Centro de Salud Maqueda,CALLE SESE&amp;Ntilde;A 44,Caramuel,Calle Caramuel nº 51,4396.155625033491
245,Centro de Especialidades Periférico Villaverde Cruce,CALLE ALCARRIA 4,Glorieta de Cádiz,Calle Antonio López nº 129,4437.527625199173
246,Centro de Salud Guayaba,CALLE ANTONIA RODRIGUEZ SACRISTAN 4,Marqués de Vadillo,Glorieta Marqués de Vadillo nº 9,4453.631248201949
247,Sanatorio Esquerdo,AVENIDA POBLADOS 70,Caramuel,Calle Caramuel nº 51,4464.680010341729
248,Centro de Salud Mental Infanto juvenil Carabanchel - Usera,CALLE ANTONIA RODRÍGUEZ SACRISTÁN 4 PLANTA 2.º A,Marqués de Vadillo,Glorieta Marqués de Vadillo nº 9,4466.810836729107
249,Centro de Atención a las Adicciones (CAD) de Villaverde,CALLE VERDE VIENTO 16,Glorieta de Cádiz,Calle Antonio López nº 129,4526.86697390916
250,Centro de Especialidades Periférico Carabanchel Alto,CALLE AGUACATE 13,Marqués de Vadillo,Glorieta Marqués de Vadillo nº 9,4562.908485004488
251,Centro de Salud Mental Aguacate-Carabanchel,CALLE DEL AGUACATE 13,Marqués de Vadillo,Glorieta Marqués de Vadillo nº 9,4564.854114890076
252,Centro de Salud San Cristóbal,CALLE BENIMAMET 24,Embajadores 191,Calle Sodio nº 1B,5177.541670898547
253,Centro de Salud San Andrés,CALLE ALBERTO PALACIOS 22,Glorieta de Cádiz,Calle Antonio López nº 129,5339.554173339254
254,Centro de Salud Rejas,CALLE EUTERPE 12,Gutierre de Cetina,Calle Gutierre de Cetina nº 77,5590.094061593232
255,Centro de Salud Mental Latina - Las Águilas,CALLE JOSE DE CADALSO PLANTA 1,Caramuel,Calle Caramuel nº 51,5651.098588311524
256,Centro de Salud Las Águilas,CALLE JOSE DE CADALSO 51,Caramuel,Calle Caramuel nº 51,5661.599271269121
257,Hospital Doctor Rodríguez Lafora,CARRETERA COLMENAR VIEJO  KM 1480 SA,Pedro Rico,Calle Pedro Rico nº 4,5672.548563019224
258,Centro de Salud Carabanchel Alto,AVENIDA CARABANCHEL ALTO 150,Marqués de Vadillo,Glorieta Marqués de Vadillo nº 9,5841.847515774302
259,Centro de Salud Aravaca,CALLE RIAZA 5,Facultad Derecho,Avenida Complutense nº 23,5866.096640499353
260,Centro de Salud Campamento,CALLE MIRUE&amp;Ntilde;A 5,Caramuel,Calle Caramuel nº 51,6162.803571040579
261,Centro de Salud General Fanjul,AVENIDA LAS AGUILAS 18,Caramuel,Calle Caramuel nº 51,6210.217355404377
262,Hospital Universitario La Zarzuela,CALLE PLEYADES 25,Facultad Derecho,Avenida Complutense nº 23,6232.248366576478
263,Hospital Vithas Madrid Pardo de Aravaca,CALLE LA SALLE 12,Facultad Derecho,Avenida Complutense nº 23,6269.613477521831
264,Centro de Salud Valle Inclan,CALLE VALLE INCLAN 97,Caramuel,Calle Caramuel nº 51,6318.619499788495
265,Hospital Enfermera Isabel Zendal,AVENIDA MANUEL FRAGA IRIBARNE 2,Carlota O’Neill,Calle Carlota O'Neill nº 32,6383.694572307537
266,Hospital Hestia Madrid,CARRETERA M-607 1600,Pedro Rico,Calle Pedro Rico nº 4,6657.849988507259
267,Centro de Salud Alameda de Osuna,CALLE CARABELA 7,Gutierre de Cetina,Calle Gutierre de Cetina nº 77,6722.890227929073
268,Centro de Salud Barajas,AVENIDA LOGRO&amp;Ntilde;O 319,Gutierre de Cetina,Calle Gutierre de Cetina nº 77,8078.976357775117
269,Centro de Salud Mental de Barajas,AVENIDA GENERAL 5 PLANTA 2ª A,Gutierre de Cetina,Calle Gutierre de Cetina nº 77,8513.330217294428
270,Centro de Salud El Pardo,CALLE CARLOS MORLA LYNCH 2,Facultad Derecho,Avenida Complutense nº 23,9185.007553959744
